{
  "description": "London Evening Standard: Jan 26th 2018",
  "grid": [
    ["Y", "_", "W", "_", "H"],
    ["_", "_", "_", "_", "_"],
    ["Q", "_", "X", "_", "D"],
    ["_", "_", "_", "_", "_"],
    ["T", "_", "G", "_", "C"]
  ],
  "words": [
    "BUG",
    "CLING",
    "DAMPING",
    "FOIL",
    "FOX",
    "HARM",
    "HAVOC",
    "JAM",
    "KEY",
    "PEW",
    "SQUINT",
    "YEW"
  ],
  "solution": [
    ["Y", "K", "W", "R", "H"],
    ["S", "E", "M", "A", "J"],
    ["Q", "P", "X", "V", "D"],
    ["B", "U", "I", "O", "F"],
    ["T", "N", "G", "L", "C"]
  ]
}
